{
  "task_id": "MEMORIES-0003",
  "implementation_cycle": 1,
  "change_cycle": 0,
  "updated_at": "2026-08-10T02:20:00+07:00",
  "completed_criteria": [
    "slice:inventory-v-mapping",
    "slice:design-foundation-tr-c-page",
    "slice:public-shell-v-navigation",
    "slice:shared-feature-components-v-mock-model",
    "slice:tri-n-khai-page-theo-vertical-slice",
    "slice:asset-management",
    "slice:responsive-accessibility-v-fidelity",
    "slice:test-v-validation"
  ],
  "changed_files": [
    "packages/design-system/src/tokens.css",
    "docs/prototype-inventory.md"
  ],
  "decisions": [
    "This is implementation attempt 8, resolving review cycle 5's fix request (worktrees/MEMORIES-0003/.ai/input/fix-request-review-5.md), which had 1 major finding: a repository-wide brand scan still matched the old prototype brand name (acceptance criterion 18's prohibited spelling) in task-created source/documentation.",
    "Finding: packages/design-system/src/tokens.css:45 had a doc comment attributing the --memories-* raw palette's origin to the old brand name, and docs/prototype-inventory.md had 3 prose references naming actual legacy-branded prototype filenames (a superseded logo asset in the dat-lam-rieng row, and the tao-thiep editor's legacy JS engine file, named twice).",
    "Fixed by rewording all 4 matches to describe the same provenance/attribution (rebranded from / ported from the prototypes' pre-existing legacy brand) without spelling the old brand name -- no token values, filenames, code, routes or tests changed.",
    "Re-scanning afterwards found the same pattern in 2 more task-created deliverables not named by the fix request: worktrees/MEMORIES-0003/.ai/validation/skills/acceptance-evidence.json's design-foundation evidence text, and this task's own prior ai/tasks/MEMORIES-0003/implementation.json (summary, one decision, one acceptance-criterion evidence string, one applied_skills bullet). All were reworded the same way.",
    "A repository-wide case-insensitive scan for the old brand name across the frontend worktree and .ai/validation now returns zero matches, excluding prototype/ itself (task.md forbids modifying prototype source) and past session-exchange transcripts/fix-request documents (logs/inputs, not task-created deliverables).",
    "Regenerated summary.json, frontend.json, delivery-gates.json (timestamps only -- command outputs re-verified unchanged) and ai/tasks/MEMORIES-0003/implementation.json (rebranding fix plus new decision/validation/applied_skills entries for this cycle) so every evidence file agrees with the current, re-verified state. No other slices/files were touched this cycle."
  ],
  "validation": [
    "frontend: npm run lint --workspaces --if-present -> pass (all 19 workspaces)",
    "frontend: npm run typecheck --workspaces --if-present -> pass (all 17 typechecked workspaces)",
    "frontend: npm run test --workspaces --if-present -> pass (public-web 9 files/28 tests, ui 9 files/26 tests, all other packages unaffected)",
    "frontend: npm run build --workspaces --if-present -> pass (public-web 22 routes incl. all 6 required routes; admin-web 25 routes, unaffected)",
    "frontend: python3 worktrees/MEMORIES-0003/.ai/validation/compare-fidelity.py -> 33/33 passed, 0 failed (unchanged)",
    "frontend: python3 ai/skills/review-frontend-ui-fidelity/scripts/check_fidelity_matrix.py worktrees/MEMORIES-0003/.ai/validation/skills/fidelity/matrix.json -> PASSED (33 entries)",
    "frontend: python3 worktrees/MEMORIES-0003/.ai/validation/check-fidelity-all-passed.py worktrees/MEMORIES-0003/.ai/validation/skills/fidelity/matrix.json -> PASSED: 33/33 entries passed",
    "frontend: python3 ai/skills/establish-frontend-design-system/scripts/check_design_system_usage.py worktrees/MEMORIES-0003/frontend -> PASSED",
    "frontend: python3 ai/skills/migrate-prototype-nextjs-page/scripts/check_prototype_migration.py worktrees/MEMORIES-0003/frontend -> PASSED",
    "frontend: python3 ai/skills/implement-nextjs-vertical-slice/scripts/check_frontend_security.py worktrees/MEMORIES-0003/frontend -> PASSED",
    "frontend: python3 ai/skills/decompose-implementation-task/scripts/validate_execution_plan.py ai/tasks/MEMORIES-0003/execution-plan.json -> PASSED (8 slices)",
    "frontend: python3 ai/skills/review-vertical-slice-completeness/scripts/build_evidence_matrix.py ai/tasks/MEMORIES-0003/execution-plan.json ai/tasks/MEMORIES-0003/implementation.json -> passed: true, missing: []",
    "frontend: python3 -c jsonschema.validate(...) against ai/schemas/implementation.schema.json -> schema valid",
    "frontend: repository-wide case-insensitive scan for the old prototype brand name across frontend/ and .ai/validation/ -> 0 matches (previously 4 matches in tokens.css/prototype-inventory.md, plus 1 in acceptance-evidence.json found during this cycle's re-scan; all fixed)"
  ],
  "current_slice": null,
  "current_step": "Review cycle 5's sole finding (leftover old-brand-name spellings in task-created source/documentation) resolved: 4 flagged matches plus 1 additional match found by re-scanning were all reworded to keep provenance information without the prohibited spelling. No code/route/test behavior changed. Full lint/typecheck/test/build and every deterministic skill/fidelity gate re-run and still pass. build_evidence_matrix.py reports passed:true with no missing criteria, and the final implementation.json is schema-valid.",
  "remaining_steps": [
    "None blocking. Non-blocking residual gaps carried over from earlier attempts, unchanged by this cycle: /tao-thiep still lacks multi-select and a persistent layers-list panel; gio-hang's cart-line items don't show a checkout-progress stepper (checkout itself is out of scope); dat-lam-rieng's portfolio cards have no image-carousel detail modal; the quick-view dialog still has no multi-image thumbnail rail since GiftProduct mock data only has a single image per product and no second-angle assets exist to back a real gallery (documented in docs/prototype-inventory.md rather than fabricated)."
  ],
  "notes": [
    "This is the 6th implementation attempt on MEMORIES-0003 (workflow-tracked as implementation attempt 8 including review cycles). This attempt is a scoped rebrand-wording fix for review cycle 5's 1 finding only -- it did not re-touch any of the other 6 routes/slices or any behavior, which remain as delivered in prior attempts and re-verified (not re-implemented) here via a full lint/typecheck/test/build re-run plus a repository-wide brand-string re-scan.",
    "No dev server or browser automation was started this cycle -- no visual/fidelity change was made, so the existing 33/33 passed matrix.json and its screenshots were re-verified as-is, not re-captured.",
    "No new npm dependencies were installed."
  ]
}
