{
  "task_id": "MEMORIES-0005",
  "implementation_cycle": 1,
  "change_cycle": 0,
  "updated_at": "2026-08-17T09:45:00Z",
  "completed_criteria": ["slice:task-requirements"],
  "changed_files": [
    "backend: (unchanged from attempt 38-40, plus) libs/platform/observability/src/logger.module.ts (custom pino-http serializers.req redacts code/state/access_token/token/id_token/client_secret from both req.query and req.url); libs/platform/observability/test/logger.module.spec.ts (new, 3 tests); libs/modules/identity-access/test/facebook-oauth.client.contract.spec.ts (rewritten — bound to fixtures/facebook-graph-api-contract/ instead of self-authored schemas, 13 tests); libs/modules/identity-access/test/fixtures/facebook-graph-api-contract/{OAuth2Client.php,Client.php,GraphUser.php,manifest.json} (new — pinned-commit snapshot of github.com/facebook/php-graph-sdk); apps/api/test/oauth-flow.e2e-spec.ts (+1 e2e test: provider error with missing/mismatched state -> access_denied, no session)",
    "frontend: (unchanged from attempt 38-40, plus) apps/public-web/app/(auth)/login/page.tsx (rewritten — now renders LoginForm/RegisterForm phone/PUBLIC pair inline instead of the legacy email form that posted an unsupported {email,password} contract); apps/public-web/test/login-page.spec.tsx (rewritten, 4 tests)",
    "evidence: ai/tasks/MEMORIES-0005/evidence/provenance.json regenerated (66 inputs, 17 artifacts); ai/tasks/MEMORIES-0005/evidence/backend-validation.log, backend-e2e.log, frontend-validation.log all regenerated from this attempt's runs; worktrees/MEMORIES-0005/.ai/validation/provenance.json re-synced",
    "workspace: ai/tasks/MEMORIES-0005/implementation.json fully updated (summary, applied_skills checks_completed, repositories/changed_files +8 files across both worktrees, decisions +4 review-cycle-10 entries, validation_commands refreshed, acceptance_criteria for slice/AC3/AC9/AC10 updated); worktrees/MEMORIES-0005/.ai/validation/summary.json regenerated via ai/bin/validate; JSON-schema and build_evidence_matrix.py both re-verified"
  ],
  "decisions": [
    "Attempt 41: received fix-request-review-010.md (review cycle 10, 3 major findings + 1 missing-evidence item, verdict changes_requested, full-plan scope). All resolved — full per-finding detail is in implementation.json's decisions array (review-cycle-10 #1 through #3, plus the missing-evidence fix).",
    "#1 OAuth code/state log leak: pino's redact.paths only strips known object paths, not substrings inside req.url, which embedded the same raw query string. Added a custom pino-http request serializer (redactSensitiveQueryParams) that redacts sensitive keys from both req.query and req.url. New integration test intercepts the real process.stdout.write pino uses (had to install the spy before app construction, since pino's default destination bypasses process.stdout.write entirely unless it's already 'tampered' at construction time). Re-ran the real oauth-flow e2e suite and grepped its full log output for zero unredacted occurrences.",
    "#2 Facebook contract self-referential: developers.facebook.com/graph.facebook.com are DNS-blackholed (resolve to 0.0.0.0) from this sandbox — verified via DNS lookup and a direct connection attempt, both failing, while google.com/github.com resolve and connect normally. web.archive.org's Wayback CDX API was also tried and returned consistent 503s across unrelated domains too. No Facebook sandbox credentials exist for this task. GitHub was reachable, so pinned the contract test to a hash-verified, pinned-commit snapshot of Meta's own official open-source Graph API SDK (github.com/facebook/php-graph-sdk, commit 6de35554c781e5450474ca062f7a1e1473a513f7) instead of a self-authored schema.",
    "#3 Public /login route: still posted the legacy {email,password} shape the backend has never accepted (LoginDto requires phone/password/portal). Rewrote the route to render the same LoginForm/RegisterForm pair as AuthModal, inline instead of in a dialog. loginSchema/LoginInput are now only used by admin-web's login page (verified via repo-wide grep) — admin login is untouched.",
    "Missing-evidence #4: added a negative e2e test proving a provider error paired with a missing or mismatched state still redirects access_denied and creates no session (OAuthController#callback checks providerError before the state-consistency check)."
  ],
  "validation": [
    "backend: full unit suite 323/323 (67 suites, +11 tests/+1 suite vs prior 312/66), lint, typecheck, test:architecture (462 modules, 0 violations), build:api — all passed",
    "backend: real e2e run against the host's already-running shared local-dev Postgres/Redis/MinIO (the exact stack this worktree's .env already points at; migration:run reported no pending migrations) — 139/139 tests passed across 16 suites, zero failures (+1 vs prior 138)",
    "frontend: typecheck, lint, test (all workspaces: 100 public-web [+1] + 37 ui + others unchanged, all green), build (public-web + admin-web) — all passed",
    "deterministic skill scripts: validate_execution_plan (1 slice, completed), check_handoff (66 exact paths, +8), check_provenance (66 inputs/17 artifacts, both canonical and synced runtime copies), check_port_bindings (32 backend tokens, unchanged), check_module_wiring (39 classes, unchanged), check_invariant_matrix (4 invariants, unchanged, runtime copy confirmed in sync), check_auth_invariants, check_openapi_contract (4 operations, unchanged), check_frontend_security, check_design_system_usage (same pre-existing/waived #efe2cf x6 finding, re-verified, unrelated files unchanged) — all passed or explained/waived",
    "JSON-schema validation against ai/schemas/implementation.schema.json: valid",
    "build_evidence_matrix.py: passed, no missing criteria",
    "no scratch infra to tear down this attempt — used the host's already-running shared local-dev Postgres/Redis/MinIO stack rather than creating an isolated one; no new devDependencies added; git status in both worktrees contains only files listed in implementation.json's changed_files"
  ],
  "current_slice": "task-requirements",
  "current_step": "fix-request-review-010.md (review cycle 10, 3 major findings + 1 missing-evidence item, verdict changes_requested) has been resolved in full: OAuth callback log redaction fixed with a real integration test, the Facebook contract test rebound to a hash-verified pinned snapshot of Meta's own official SDK source (developers.facebook.com/graph.facebook.com confirmed DNS-blocked from this sandbox), the public /login route now shares the modal's phone/PUBLIC contract, and a negative provider-error/missing-state test was added. implementation.json fully updated and re-validated (schema-valid, handoff/provenance/evidence-matrix all pass, backend unit 323/323, backend e2e 139/139 zero-failure, frontend all green). Ready for the next review cycle.",
  "remaining_steps": [],
  "notes": [
    "Attempts 10-36 (27 consecutive runs): empty-gates orchestration-loop pattern, no implementation defect — see memory memories-0005-stuck-delivery-gate-loop.md.",
    "Attempt 37: review cycle 4, 7 real findings, all fixed. Attempt 38: review cycle 6, 5 real findings, all fixed. Attempts 39-40: review cycle 9, 4 findings, all fixed. Attempt 41: review cycle 10, 3 major findings + 1 missing-evidence item, all fixed.",
    "check_design_system_usage.py's pre-existing #efe2cf finding (card/gift-catalog swatch mock data, untouched by this slice) remains waived as out-of-scope — unchanged across every cycle.",
    "This attempt used the host's already-running shared local-dev infrastructure (Postgres :15432/Redis :16379/MinIO :19000, matching this worktree's checked-in .env) rather than spinning up an isolated per-attempt stack — no infra was created or torn down."
  ]
}
