{
  "task_id": "MEMORIES-0009",
  "implementation_cycle": 1,
  "change_cycle": 0,
  "updated_at": null,
  "completed_criteria": [],
  "changed_files": [],
  "decisions": [],
  "validation": [],
  "current_slice": null,
  "current_step": "Inspect requirements and existing worktree changes",
  "remaining_steps": [],
  "notes": []
}
